{
  "id": "base:hundred_checks_tier_2",
  "type": "achievement",
  "name": "loc:achievement.hundred_checks_tier_2",
  "description": "loc:achievement.hundred_checks_tier_2.description",
  "hidden": false,
  "condition": {
    "event": "component_check_resolved",
    "count": 500
  },
  "tags": []
}
